{
  "name": "Olimex iCE40HX1K-EVB",
  "url": "https://www.olimex.com/Products/FPGA/iCE40/iCE40HX1K-EVB/open-source-hardware",
  "fpga": {
    "vendor": "Lattice",
    "family": "iCE40 HX",
    "part": "iCE40HX1K",
    "source": "product-page",
    "confidence": "confirmed"
  },
  "section": "HX1K",
  "category": "dev-board",
  "programming": {
    "interface": "Serial",
    "details": null
  },
  "companion_mcu": [],
  "connectivity": [],
  "pmod_count": null,
  "osh": false,
  "maker": "Olimex",
  "description": "An Olimex iCE40 HX1K evaluation board.",
  "links": [],
  "tags": [],
  "outdated": false,
  "last_updated": "2026-09-22",
  "toolchain": "open",
  "form_factor": null,
  "repo": null
}
