{
  "name": "riegel",
  "url": "https://github.com/machdyne/riegel",
  "fpga": {
    "vendor": "Lattice",
    "family": "iCE40 HX",
    "part": "iCE40HX4K",
    "source": "repo",
    "confidence": "confirmed"
  },
  "section": "HX4K",
  "category": "dev-board",
  "programming": {
    "interface": "USB-bootloader",
    "details": "Flash MMOD updated over USB-C with the USB DFU protocol; initial bootloader via the ISP header."
  },
  "companion_mcu": [],
  "connectivity": [],
  "pmod_count": null,
  "osh": true,
  "maker": "Lone Dynamics Corporation",
  "description": "Riegel is an FPGA computer designed by Lone Dynamics Corporation.",
  "links": [],
  "tags": [],
  "outdated": false,
  "last_updated": "2026-09-22",
  "toolchain": "open",
  "form_factor": null,
  "repo": "https://github.com/machdyne/riegel"
}
