{
  "name": "iCEBreaker",
  "url": "https://www.crowdsupply.com/1bitsquared/icebreaker-fpga",
  "fpga": {
    "vendor": "Lattice",
    "family": "iCE40 UltraPlus",
    "part": "iCE40UP5K",
    "source": "product-page",
    "confidence": "confirmed"
  },
  "section": "UP5K",
  "category": "dev-board",
  "programming": {
    "interface": "FTDI",
    "details": null
  },
  "companion_mcu": [],
  "connectivity": [],
  "pmod_count": null,
  "osh": true,
  "maker": "1bitsquared",
  "description": "A popular open-source iCE40UP5K education/dev board by 1BitSquared with a PMOD-centric layout.",
  "links": [],
  "tags": [],
  "outdated": false,
  "last_updated": "2026-09-22",
  "toolchain": "open",
  "form_factor": null,
  "repo": null
}
