{
  "name": "iCE40 UltraPlus Breakout Board",
  "url": "https://www.latticesemi.com/en/Products/DevelopmentBoardsAndKits/iCE40UltraPlusBreakoutBoard",
  "fpga": {
    "vendor": "Lattice",
    "family": "iCE40 UltraPlus",
    "part": "iCE40UP5K",
    "source": "product-page",
    "confidence": "confirmed"
  },
  "section": "UP5K",
  "category": "dev-board",
  "programming": {
    "interface": "proprietary",
    "details": "Programmed over USB (FTDI); Lattice proprietary tooling."
  },
  "companion_mcu": [],
  "connectivity": [],
  "pmod_count": null,
  "osh": false,
  "maker": "Lattice Semiconductor",
  "description": "iCE40 UltraPlus breakout board that enables designers to evaluate key connectivity features of the iCE40 UltraPlus FPGA; brings out all I/Os and allows the FPGA to be programmed over a USB connector.",
  "links": [],
  "tags": [
    "breakout"
  ],
  "outdated": false,
  "last_updated": "2026-09-22",
  "toolchain": "open",
  "form_factor": null,
  "repo": null
}
