{
  "name": "Precursor",
  "url": "https://www.crowdsupply.com/sutajio-kosagi/precursor",
  "fpga": {
    "vendor": "Lattice",
    "family": "iCE40 UltraPlus",
    "part": "iCE40UP5K",
    "source": "teardown",
    "confidence": "confirmed"
  },
  "section": "Other commercial products / UP5K",
  "category": "commercial",
  "programming": {
    "interface": null,
    "details": "Factory-programmed FPGA inside a shipping product; not user-programmable."
  },
  "companion_mcu": [],
  "connectivity": [],
  "pmod_count": null,
  "osh": true,
  "maker": "Kosagi",
  "description": "Contains an iCE40UP5K.",
  "links": [],
  "tags": [],
  "outdated": false,
  "last_updated": "2026-09-22",
  "toolchain": "open",
  "form_factor": null,
  "repo": null
}
