{
  "name": "iCEboy",
  "url": "https://github.com/rniwase/iCEboy",
  "fpga": {
    "vendor": "Lattice",
    "family": "iCE40 UltraPlus",
    "part": "iCE40UP5K",
    "source": "repo",
    "confidence": "confirmed"
  },
  "section": "UP5K",
  "category": "dev-board",
  "programming": {
    "interface": "FTDI",
    "details": "Programmed by a separate FT2232H-based 'tGB-prog' board that SPI-programs the W25Q80 flash (pyftdi)."
  },
  "companion_mcu": [
    "FT2232H"
  ],
  "connectivity": [],
  "pmod_count": null,
  "osh": true,
  "maker": null,
  "description": "Nintendo Game Boy cartridge-shaped FPGA development board (Lattice iCE40UP5K).",
  "links": [],
  "tags": [
    "gameboy",
    "retro"
  ],
  "outdated": false,
  "last_updated": "2026-09-22",
  "toolchain": "open",
  "form_factor": "cartridge",
  "repo": "https://github.com/rniwase/iCEboy"
}
