{
  "name": "Colorlight I5_V6",
  "url": "https://github.com/wuxx/Colorlight-FPGA-Projects",
  "fpga": {
    "vendor": "Lattice",
    "family": "ECP5",
    "part": "LFE5U-25F",
    "source": "teardown",
    "confidence": "confirmed"
  },
  "section": "Other commercial products / ECP5",
  "category": "commercial",
  "programming": {
    "interface": "JTAG",
    "details": "Programmed via on-board JTAG pads; a HUB75 LED receiver card repurposed as an ECP5 dev board."
  },
  "companion_mcu": [],
  "connectivity": [],
  "pmod_count": null,
  "osh": true,
  "maker": "Colorlight",
  "description": "Colorlight I5_V6 ECP5 board with pin breakdowns by JohnnyW11773607.",
  "links": [
    {
      "label": "testbed",
      "url": "https://twitter.com/JohnnyW11773607/status/1306807958165020672/photo/1"
    }
  ],
  "tags": [
    "led-panel"
  ],
  "outdated": false,
  "last_updated": "2026-09-22",
  "toolchain": "open",
  "form_factor": null,
  "repo": "https://github.com/wuxx/Colorlight-FPGA-Projects"
}
