{
  "name": "UPDuino v1.0",
  "url": "http://www.gnarlygrey.com/?i=1",
  "fpga": {
    "vendor": "Lattice",
    "family": "iCE40 UltraPlus",
    "part": "iCE40UP5K",
    "source": "product-page",
    "confidence": "confirmed"
  },
  "section": "UP5K",
  "category": "dev-board",
  "programming": {
    "interface": "Serial",
    "details": null
  },
  "companion_mcu": [],
  "connectivity": [],
  "pmod_count": null,
  "osh": true,
  "maker": "gnarlygrey",
  "description": "An early low-cost iCE40UP5K board by gnarlyGrey.",
  "links": [],
  "tags": [],
  "outdated": true,
  "last_updated": "2026-09-22",
  "toolchain": "open",
  "form_factor": null,
  "repo": null
}
